<?xml version="1.0" encoding="windows-1252"?>
<!DOCTYPE stock SYSTEM "exemple.dtd">
<stock>
  <?xml-stylesheet
    href="monStyle.css" media="screen"
    title="Compact" type="text/css" ?>
  <produit>
    <nom> Découvrir &testEntity;  <![CDATA[ XML ]]> </nom>
    <!--Ceci est un commentaire -->
    <prix monnaie="Euros"> 50 </prix>
  </produit>
  <produit>
  <nom> CD </nom>
 </produit>
 <untruc>
  	<nom> bla </nom>
  </untruc>
</stock>
